{
  "schema_version": "step5d_autotune_campaign_v1",
  "stage_id": "step5d_strict_rnn_autotune_v1",
  "source_stage_id": "step5d_strict_rnn_ablation_v35",
  "activation": {
    "active": true,
    "controller_readback_verified": true,
    "live_authorized": true,
    "claim_boundary": "controller package delivery/readback is automatic and does not authorize bridge start, program load/Play, zero/tare, contact, or motion"
  },
  "baseline": {
    "target_force_n": 12.0,
    "force_candidate": {
      "force_p_gain": 0.001,
      "force_i_gain": 0.00001,
      "force_damping": 7.0
    },
    "outer_tangential_kp": 1.5,
    "execution_profile_id": "nf050-slew050-a050",
    "execution_profile_integer_id": 533,
    "normal_filter_tau_s": 0.35,
    "normal_filter_dt_mode": "fixed_0.002s",
    "f0_shadow_reaction_normal_base": [0.0, 0.0, 1.0],
    "normal_max_rate_rad_s": 0.05,
    "qdot_cap_rad_s": 0.5,
    "host_qdot_slew_rad_s2": 0.5,
    "tp_speedj_accel_rad_s2": 0.5
  },
  "objective": {
    "name": "signed_reaction_normal_12N_mae",
    "stage": 25.0,
    "window_s": [5.0, 60.0],
    "bin_s": 0.1,
    "required_complete_bins": 550,
    "fixed_f0_shadow_normal_required": true,
    "success_mae_n": 0.3,
    "confirmation_trials": 1
  },
  "search": {
    "coordinate_system": "log10_i_scale_probe_then_log2_native_refine",
    "force_damping_policy": {
      "finite_positive": true,
      "unbounded": true
    },
    "orientation_ko_min": 0.1,
    "orientation_ko_max": 0.8,
    "orientation_catalog_mode": "observed_force_anchor_variants",
    "physics_soft_prior": {
      "enabled": true,
      "contact_stiffness_n_m": 32000.0,
      "target_damping_ratio": 0.7071067811865476,
      "log2_sigma_octaves": 2.0,
      "strength": 0.35
    },
    "lattice_octaves": 0.25,
    "one_coordinate_per_live_trial": true,
    "i_zero_is_categorical": true,
    "trial_budget_stop_enabled": false,
    "low_ei_stop_enabled": false,
    "exact_parameter_set_max_trials_per_profile": 1,
    "first_threshold_hit_succeeds": true,
    "outer_boundary_requires_pointwise_replay_unlock": true,
    "batch_grid": {
      "mode": "codex_managed_hybrid_i_batches",
      "p_d_coordinate_bounds_octaves": [-1, 1],
      "lattice_octaves": 0.25,
      "i_coarse_multipliers": [10, 50, 100, 500, 1000],
      "coordinate_order": ["force_p_gain", "force_i_gain", "force_damping"],
      "positive_i_only": true,
      "candidates_per_batch": 5,
      "parameter_only_batch_update_changes_code_fingerprint": false,
      "first_threshold_hit_stops_batching": false,
      "governor_probes_enabled": false,
      "i_axis_requires_t2_unlock": false
    },
    "tiers": {
      "T1": {"p_d_radius_octaves": 1.0, "positive_i_radius_octaves": 0.0, "fixed_i_gain": 0.00001},
      "T2": {
        "p_d_radius_octaves": 1.5,
        "positive_i_radius_octaves": 1.0,
        "unlock": {"minimum_eligible_trials": 6, "recent_structural_failure_window": 6, "recent_structural_failures_max": 0}
      },
      "T3": {
        "p_d_radius_octaves": 2.0,
        "positive_i_radius_octaves": 2.0,
        "unlock": {"adjacent_outward_improvements_required": 2, "boundary_point_must_be_eligible": true, "recent_eligible_trials_required": 6, "candidate_bound_latest_trace_replay": ["exact_rnn", "oracle", "slew"]}
      }
    },
    "plant_epoch_policy": {
      "observations_cross_epoch_training_allowed": false,
      "kept_profile_creates_new_epoch": true,
      "reverted_profile_restores_prior_epoch_history": true
    }
  },
  "execution_profiles": [
    {"profile_id": "nf010-slew010-a010", "integer_id": 111, "normal_max_rate_rad_s": 0.01, "host_qdot_slew_rad_s2": 0.1, "tp_speedj_accel_rad_s2": 0.1, "live_eligible": true},
    {"profile_id": "nf015-slew010-a010", "integer_id": 211, "normal_max_rate_rad_s": 0.015, "host_qdot_slew_rad_s2": 0.1, "tp_speedj_accel_rad_s2": 0.1, "live_eligible": true},
    {"profile_id": "nf020-slew020-a020", "integer_id": 322, "normal_max_rate_rad_s": 0.02, "host_qdot_slew_rad_s2": 0.2, "tp_speedj_accel_rad_s2": 0.2, "live_eligible": true},
    {"profile_id": "nf030-offline", "integer_id": 411, "normal_max_rate_rad_s": 0.03, "host_qdot_slew_rad_s2": 0.1, "tp_speedj_accel_rad_s2": 0.1, "live_eligible": false},
    {"profile_id": "nf050-slew050-a050", "integer_id": 533, "normal_max_rate_rad_s": 0.05, "host_qdot_slew_rad_s2": 0.5, "tp_speedj_accel_rad_s2": 0.5, "live_eligible": true}
  ],
  "governor": {
    "normal_rate_ladder_rad_s": [0.01, 0.015, 0.02, 0.05],
    "host_slew_ladder_rad_s2": [0.1, 0.2, 0.5],
    "tp_speedj_accel_ladder_rad_s2": [0.1, 0.2, 0.5],
    "trigger": {"independent_windows": 2, "window_s": 5.0, "minimum_saturation_fraction": 0.2, "or_continuous_saturation_s": 2.0},
    "keep": {"minimum_burden_reduction": 0.3, "maximum_mae_regression": 0.15, "cooldown_eligible_trials": 3},
    "probe_protocol": {"force_candidate_frozen": true, "one_layer_at_a_time": true, "sequence": ["A", "B"], "ambiguous_reverts_without_repeat": true, "failed_probe_reverts_immediately": true},
    "qdot_cap_optimizer_dimension": false,
    "lag_alone_triggers_change": false
  },
  "orientation_qualification": {
    "window_s": [5.0, 60.0],
    "entry_window_s": [0.0, 5.0],
    "p95_error_max_rad": 0.036,
    "absolute_error_max_rad": 0.05,
    "angular_saturation_duty_max": 0.05,
    "gross_safety_guards_changed": false
  },
  "integer_handshake": {
    "host_to_tp": {"campaign_epoch": 24, "trial_id": 25, "command": 26, "candidate_token": 27, "execution_profile_id": 28, "command_sequence": 29},
    "tp_to_host": {"campaign_epoch_echo": 24, "trial_id_echo": 25, "state": 26, "candidate_token_echo": 27, "terminal_reason": 28, "execution_profile_id_echo": 29, "consumed_command_sequence": 30}
  },
  "safe_closure": {
    "tp": {"position_error_max_m": 0.003, "orientation_error_max_rad": 0.05, "joint_error_max_rad": 0.01},
    "host": {"continuous_dwell_s": 0.5, "safety_mode": "NORMAL", "position_error_max_m": 0.003, "orientation_error_max_rad": 0.05, "joint_error_max_rad": 0.01, "tcp_linear_speed_max_m_s": 0.001, "tcp_angular_speed_max_rad_s": 0.01, "qd_max_rad_s": 0.01},
    "ack_requires_immutable_bundle": true
  },
  "failure_policy": {
    "infra_reasons": [8, 10, 12, 14],
    "manual_recovery_reasons": [2, 3],
    "campaign_stop_reasons": [5, 6, 7, 17],
    "code_contract_reason": 13,
    "reason4_requires_host_cause": true,
    "exact_parameter_set_reuse_allowed": false,
    "evidence_failure_records_outcome_then_advances": true,
    "infra_or_code_recovery_advances_to_untried_parameter_set": true,
    "code_change_requires_new_campaign_epoch_fingerprint_and_authorization": true,
    "scheduler_feedback_rnn_cadence_lag_are_tp_guards": false
  }
}
